{
  "bootstrap_mode": "presence-check-only",
  "control_plane_mutations": {
    "deployment_updated": false,
    "eval_latest_updated": false,
    "promotion_updated": false,
    "readiness_updated": false,
    "registry_updated": false,
    "release_artifacts_updated": false,
    "work_state_updated": false
  },
  "export_bundle_path": "dist/exports/runtime-evidence/external-runtime-evidence-json-health-checker-operator-hint-branch-build-pack-v1-continuity-run-v1-20260325T191912Z",
  "export_command": "python3 src/pack_export_runtime_evidence.py --pack-root . --run-id json-health-checker-operator-hint-branch-build-pack-v1-continuity-run-v1 --exported-by codex --output-dir dist/exports/runtime-evidence --output json",
  "export_completed_at": "2026-03-25T19:19:12Z",
  "export_error": null,
  "export_status": "succeeded",
  "exported_run_id": "json-health-checker-operator-hint-branch-build-pack-v1-continuity-run-v1",
  "prompt_artifact_path": ".packfactory-remote/invocation-prompt.txt",
  "prompt_sha256": "bd03a13771f13ec9e55062249fe8c56eb263bc6c12695cad8901728891883e48",
  "remote_runner": "python3 - <<'PY'\nfrom __future__ import annotations\n\nimport json\nimport sys\nfrom datetime import datetime, timezone\nfrom pathlib import Path\n\nsys.path.insert(0, str((Path(\".packfactory-runtime/tools\")).resolve()))\nfrom record_autonomy_run import append_event\n\nRUN_ID = \"json-health-checker-operator-hint-branch-build-pack-v1-continuity-run-v1\"\nPACK_ROOT = Path(\".\").resolve()\nMEMORY_DIR = PACK_ROOT / \".pack-state\" / \"agent-memory\"\nLATEST_MEMORY_PATH = MEMORY_DIR / \"latest-memory.json\"\n\n\ndef now() -> str:\n    return datetime.now(timezone.utc).replace(microsecond=0).isoformat().replace(\"+00:00\", \"Z\")\n\n\ndef load_json(path: Path) -> dict[str, object]:\n    payload = json.loads(path.read_text(encoding=\"utf-8\"))\n    if not isinstance(payload, dict):\n        raise SystemExit(f\"{path} did not contain a JSON object\")\n    return payload\n\n\ndef write_json(path: Path, payload: dict[str, object]) -> None:\n    path.parent.mkdir(parents=True, exist_ok=True)\n    path.write_text(json.dumps(payload, indent=2, sort_keys=True) + \"\\n\", encoding=\"utf-8\")\n\n\ndef latest_feedback_memory() -> tuple[Path, dict[str, object], str]:\n    if LATEST_MEMORY_PATH.exists():\n        pointer_doc = load_json(LATEST_MEMORY_PATH)\n        selected_memory_path = pointer_doc.get(\"selected_memory_path\")\n        if not isinstance(selected_memory_path, str) or not selected_memory_path:\n            raise SystemExit(\"latest-memory.json is missing selected_memory_path\")\n        memory_path = (PACK_ROOT / selected_memory_path).resolve()\n        if not memory_path.exists():\n            raise SystemExit(f\"latest-memory.json pointed at a missing file: {memory_path}\")\n        return memory_path, load_json(memory_path), \"latest_pointer\"\n\n    candidates = sorted(MEMORY_DIR.glob(\"autonomy-feedback-*.json\"))\n    if not candidates:\n        raise SystemExit(\"expected at least one factory-default feedback-memory artifact under .pack-state/agent-memory\")\n    path = candidates[-1]\n    return path, load_json(path), \"directory_fallback\"\n\n\nmemory_path, memory_doc, memory_source = latest_feedback_memory()\nwork_state = load_json(PACK_ROOT / \"status/work-state.json\")\nreadiness = load_json(PACK_ROOT / \"status/readiness.json\")\ncanonical_next_task = work_state.get(\"next_recommended_task_id\")\nmemory_next_task = memory_doc.get(\"next_recommended_task_id\")\nautonomy_state = work_state.get(\"autonomy_state\")\nready_for_deployment = bool(readiness.get(\"ready_for_deployment\"))\n\nif autonomy_state != \"ready_for_deploy\":\n    raise SystemExit(f\"unexpected autonomy_state: {autonomy_state}\")\nif canonical_next_task is not None:\n    raise SystemExit(f\"expected no canonical next task at deployment boundary, found {canonical_next_task!r}\")\nif not ready_for_deployment:\n    raise SystemExit(\"expected readiness.ready_for_deployment to be true\")\nif memory_next_task is not None:\n    raise SystemExit(f\"expected feedback memory to carry no next task at deployment boundary, found {memory_next_task!r}\")\n\nmemory_ingress_path = PACK_ROOT / \".pack-state\" / \"autonomy-runs\" / RUN_ID / \"memory-ingress.json\"\nwrite_json(\n    memory_ingress_path,\n    {\n        \"memory_path\": memory_path.as_posix(),\n        \"memory_run_id\": memory_doc.get(\"run_id\"),\n        \"memory_generated_at\": memory_doc.get(\"generated_at\"),\n        \"memory_source\": memory_source,\n        \"canonical_next_task\": canonical_next_task,\n        \"memory_next_task\": memory_next_task,\n        \"autonomy_state\": autonomy_state,\n        \"ready_for_deployment\": ready_for_deployment,\n        \"recorded_at\": now(),\n    },\n)\n\nappend_event(\n    pack_root=PACK_ROOT,\n    run_id=RUN_ID,\n    event_type=\"task_selected\",\n    outcome=\"confirmed_deployment_boundary_from_feedback_memory\",\n    decision_source=\"canonical_plus_memory\",\n    memory_state=\"used_and_consistent\",\n    commands_attempted=[],\n    notes=[\n        f\"Loaded factory-default feedback memory from {memory_path.as_posix()} via {memory_source}.\",\n        \"Canonical state and feedback memory both indicated the pack was already at the deployment boundary.\",\n        \"Stopped cleanly without replaying starter tasks.\",\n    ],\n    evidence_paths=[memory_ingress_path.relative_to(PACK_ROOT).as_posix()],\n    stop_reason=None,\n    active_task_id=None,\n    next_recommended_task_id=None,\n)\n\nprint(\n    json.dumps(\n        {\n            \"status\": \"completed\",\n            \"memory_path\": memory_path.as_posix(),\n            \"memory_run_id\": memory_doc.get(\"run_id\"),\n            \"memory_source\": memory_source,\n            \"autonomy_state\": autonomy_state,\n            \"ready_for_deployment\": ready_for_deployment,\n            \"next_recommended_task_id\": canonical_next_task,\n        },\n        sort_keys=True,\n    )\n)\nPY",
  "request_sha256": "dfb89ab99435bc950b44b3b5fbaa5a1f4f3696f9072cb66f59d127cb97dd739e",
  "run_id": "json-health-checker-operator-hint-branch-build-pack-v1-continuity-run-v1",
  "schema_version": "remote-execution-manifest/v1",
  "source_build_pack_id": "json-health-checker-operator-hint-branch-build-pack-v1",
  "started_at": "2026-03-25T19:19:12Z",
  "stopped_at": "2026-03-25T19:19:12Z",
  "target_manifest_sha256": "2e35a59ba499119d363db7e8f262bdc352dfd81e607acd0f8cda070fdfe8ac9a",
  "terminal_outcome": "promotion_or_deployment_boundary",
  "terminal_reason": "starter_backlog_completed"
}
